{
  "critical": 0,
  "high": 0,
  "medium": 0,
  "low": 0,
  "info": 0,
  "evidence_missing": [],
  "sources": {
    "plan-coverage-validator": {
      "status": "skipped",
      "reason": "validator unavailable or N/A"
    },
    "schema-validator": {
      "status": "ok",
      "findings": {
        "critical": 0,
        "high": 0,
        "medium": 0,
        "low": 0,
        "info": 0
      }
    }
  }
}
