{
  "critical": 0,
  "high": 0,
  "medium": 0,
  "low": 1,
  "info": 0,
  "evidence_missing": [],
  "sources": {
    "discovery-extraction-validator": {
      "status": "ok",
      "findings": {
        "critical": 0,
        "high": 0,
        "medium": 0,
        "low": 0,
        "info": 0
      }
    },
    "schema-validator": {
      "status": "ok",
      "findings": {
        "critical": 0,
        "high": 0,
        "medium": 0,
        "low": 0,
        "info": 0
      }
    },
    "br-cross-consistency-validator": {
      "status": "ok",
      "findings": {
        "critical": 0,
        "high": 0,
        "medium": 0,
        "low": 1,
        "info": 0,
        "br_overall_score": 0.975,
        "br_overall_threshold": 0.85,
        "br_gate_status": "pass"
      }
    }
  }
}
